id,id_bl,id_si,id_eoy22,cohort,ayear,sample,sent,place,reason
1806,5916,NA,NA,1920,1920,us ug,Belong,AtriumEast,i would always go there when i just wanted to relax and or do homework a traditional spot for me always got my work done best there
1806,5916,NA,NA,1920,1920,us ug,Belong,Courtyard,it became a routine that i would get food in the emu after my last class and i would always eat at this location met a lot of good people and connections
1806,5916,NA,NA,1920,1920,us ug,Belong,FallingSky,love the people who work there and they have amazing food all around good vibes
1809,6845,NA,NA,1920,1920,us ug,Belong,Starbucks,i order online and do not have to talk to anybody
1810,3405,NA,NA,1819,1920,us ug,Belong,FallingSky,it where i would go to eat sometimes
1811,6927,NA,NA,1920,1920,us ug,Belong,Courtyard,separate places to sit
1811,6927,NA,NA,1920,1920,us ug,Belong,Fishbowl,food
1813,2414,NA,NA,1819,1920,us ug,Belong,Craft,i like crafting esp in maker spaces
1813,2414,NA,NA,1819,1920,us ug,Belong,DuckNest,they are very nice
1813,2414,NA,NA,1819,1920,us ug,Belong,LGBTQA3,i am gay
213,790,NA,NA,1617,1920,us ug,Belong,Courtyard,it one of the places i would do homework while i was living off campus in eugene
213,790,NA,NA,1617,1920,us ug,Belong,FallingSky,i also would do my homework and study here often after i turned 21
213,790,NA,NA,1617,1920,us ug,Belong,OLounge,i would also do homework and study here
1816,5938,NA,NA,1920,1920,us ug,Belong,AtriumEast,i like being surrounded by other students doing school work everyone is respectful of those around them
1816,5938,NA,NA,1920,1920,us ug,Belong,Fishbowl,most people here are minding there own business and if i ever see someone i know they are always very nice
1821,2767,NA,NA,1819,1920,us ug,Belong,OLounge,i used to hang out there with my friends all the time it a very comfortable space with a bunch of people around doing their own thing and the swivel chairs are fun plus you can smell falling sky from there
1821,2767,NA,NA,1819,1920,us ug,Belong,TaylorLounge,this place is relaxing the chairs are comfy the atmosphere is calm sometimes someone plays the piano just all around of the best places to do homework or take a nap in the emu
1826,2273,NA,NA,1819,1920,us ug,Belong,AtriumEast,i always study here or meet friends here its somehow just loud enough to let you mind your own business and just quiet enough to be a good time with friends
1826,2273,NA,NA,1819,1920,us ug,Belong,Courtyard,this is a very chill place where a lot of people eat just super good vibes and i meet my friends here or i study here
1826,2273,NA,NA,1819,1920,us ug,Belong,Mills,i think was trying to click the balcony area i love to look out on the auditorium area where the flags are i drink starbucks up there and do homework up there
1829,8275,NA,NA,1920,1920,us ug,Belong,Fishbowl,i selected the fishbowl just because it another place where pretty much everybody might go i liked to get starbucks and hang around this area while doing so the open windows and open environment of the place is just nice
1829,8275,NA,NA,1920,1920,us ug,Belong,MCC,the multicultural center is the main place where i feel connected to at the emu because i have participated in culture related programs there it is a wide space with a lot of different things all over the room and it feels like a lot of the people involved in the place are very welcoming of anyone i feel a connection with it especially as it is probably the first place i went to for a club
1829,8275,NA,NA,1920,1920,us ug,Belong,Womens,during the school year i would go to the women center to print papers it would be often where i came in and whoever was sitting at the front desk would give a very kind greeting sometimes this would not happen i think that seeing all the resources they provide and knowing that they are welcoming of anyone of any demographic including any gender in this place
1830,700,NA,NA,1617,1920,us ug,Belong,OLounge,i study here i can hide away in the booths and stay to myself
1830,700,NA,NA,1617,1920,us ug,Belong,Womens,it a place for women it a resource i know i am not going to be judged there because they have an inclusive atmosphere
1831,1558,NA,NA,1819,1920,us ug,Belong,DuckNest,i can do my own thing without issue the people working there are kind and supportive and the people who utilize the space are polite and respectful
1834,7887,NA,NA,1920,1920,us ug,Belong,Fishbowl,this is were me and my friends would hang out and get food and talk
1835,6138,NA,NA,1920,1920,us ug,Belong,Craft,i am an extrememly creative person and when i needed an outlet from the stress because of classes or my roommate this was my haven
1835,6138,NA,NA,1920,1920,us ug,Belong,Fishbowl,it a place to meet up with friends and eat or drink its a central point of campus where everyone goes for a coffee or food and to meet up with friends
1839,3149,NA,NA,1819,1920,us ug,Belong,FallingSky,place of food
1841,8210,NA,NA,1920,1920,us ug,Belong,FallingSky,i really love the layout of this pizzeria and the spread out seating and colored tiles i love doing homework here
1846,3408,NA,NA,1819,1920,us ug,Belong,MCC,my questions are always answered respectfully
1846,3408,NA,NA,1819,1920,us ug,Belong,OLounge,i can study with anyone at anytime
1847,5473,NA,NA,1920,1920,us ug,Belong,FallingSky,this is a really nice place to build community i have hosted open mics here and it a really fun space
1847,5473,NA,NA,1920,1920,us ug,Belong,LGBTQA3,a lot of my friends work here or come here often so i know that i will see a familiar face
1847,5473,NA,NA,1920,1920,us ug,Belong,Womens,everyone is really nice there and it a comfortable space
311,1093,NA,NA,1617,1920,us ug,Belong,Craft,because i worked there
1851,7076,NA,NA,1920,1920,us ug,Belong,Fishbowl,cool place where a lot of people congregate and so it has a nice community feeling
1851,7076,NA,NA,1920,1920,us ug,Belong,MCC,there are a lot of people willing to talk to me and they have a lot of different life experiences which i think is really cool to learn about
1868,5536,NA,NA,1920,1920,us ug,Belong,Craft,i feel like i can relate to people there
671,4434,NA,NA,1819,1920,us ug,Belong,AtriumEast,nice place to work on homework and see friends
671,4434,NA,NA,1819,1920,us ug,Belong,OLounge,i spend a lot of time here and i like how there are people there but it also feels secluded
681,1639,NA,NA,1819,1920,us ug,Belong,AtriumEast,i feel comfortable doing my work here surrounded by other students
681,1639,NA,NA,1819,1920,us ug,Belong,Womens,i have had positive experiences here as a woman
979,5585,NA,NA,1920,1920,us ug,Don't Belong,Fishbowl,it feels dirty like fast food and i do not eat or study here and no one who i know ever does
979,5585,NA,NA,1920,1920,us ug,Don't Belong,MCC,i am a white person i feel like i am intruding on a safe space
979,5585,NA,NA,1920,1920,us ug,Don't Belong,Mills,because i work there and am still getting to know my coworkers who are all very different from me and i know it for people from all over but i still feel white guilt and like i look different and that i am in someone else safe space when i am there
989,8338,NA,NA,1920,1920,us ug,Don't Belong,OLounge,i am naturally shy and the constant crowd in the lounge made me feel like an outsider
1012,1889,NA,NA,1819,1920,us ug,Don't Belong,Fishbowl,just always a lot of folks who seem fairly unwelcoming
1012,1889,NA,NA,1819,1920,us ug,Don't Belong,OLounge,just always a lot of folks who seem fairly unwelcoming
1012,1889,NA,NA,1819,1920,us ug,Don't Belong,TaylorLounge,just always a lot of folks who seem fairly unwelcoming
1018,3233,NA,NA,1819,1920,us ug,Don't Belong,LGBTQA3,although it seems to be a place where everyone is welcome it is a place that does not seem welcoming to someone who is not already a part of the community
1018,3233,NA,NA,1819,1920,us ug,Don't Belong,MCC,i am not sure
1018,3233,NA,NA,1819,1920,us ug,Don't Belong,Womens,the women center only seems to support one type of view and if someone does not have the same views then they do not fit in
1026,5757,NA,NA,1920,1920,us ug,Don't Belong,MCC,i just do not have knowledge on center and i am unaware of what goes on in there
1031,2651,NA,NA,1819,1920,us ug,Don't Belong,Courtyard,it feels like everyone is doing their own thing meeting with friends getting coffee with someone i do not feel like i can just hang out on my own at a table like i need to be doing something social in order to be there
638,1730,NA,NA,1819,1920,us ug,Don't Belong,Fishbowl,the fishbowl is always so busy and it always difficult to find somewhere to sit people take up multiple tables for 2 people and are not very respectful of the time of day or the occupancy of the space at the time
1052,5010,NA,NA,1920,1920,us ug,Don't Belong,Courtyard,same as the other answer i typically sit alone
1052,5010,NA,NA,1920,1920,us ug,Don't Belong,FallingSky,i never have anyone to go with me and i hate being alone
1052,5010,NA,NA,1920,1920,us ug,Don't Belong,Fishbowl,i do not have many friends
1055,6342,NA,NA,1920,1920,us ug,Don't Belong,FallingSky,just not really a place i enjoy it does not always feel super friendly
1055,6342,NA,NA,1920,1920,us ug,Don't Belong,Fishbowl,it feels so constricted and i get claustrophobic in there because it as if everyone stares when you walk in and there is constantly these long lines of people to awkwardly move around and navigate through
1140,2846,NA,NA,1819,1920,us ug,Don't Belong,AtriumEast,it feels like everyone stares at you when you walk through here so i would not want to be there
1140,2846,NA,NA,1819,1920,us ug,Don't Belong,Craft,the craft center feels like a place only for the elite since you have to pay to do anything since i do not have money i feel like i would not be welcomed in
1140,2846,NA,NA,1819,1920,us ug,Don't Belong,OLounge,since it is frequently taken over by sports it feels like i should not be there
1141,4634,NA,NA,1920,1920,us ug,Don't Belong,Courtyard,too many kids i do not like crowds that it
1141,4634,NA,NA,1920,1920,us ug,Don't Belong,Fishbowl,the part of the uo culture that is rich upper class unaware of the struggles that other humans face everyday in and outside of the u s and are much more focused on buying starbucks coffee than doing their homework tend to hangout in this area i do not know y all i am paying to be at this university to learn not to get along with kids who are literally still just as immature and self centered as they were in high school you should not be surprised that i do not feel welcome in any given area of campus because the majority of your students are exactly what i just described immature and self centered
1194,6582,NA,NA,1920,1920,us ug,Don't Belong,AtriumEast,mostly its just because of my social anxiety there usually a lot of people here socializing and so its not a place where i can focus or feel easily comfortable
1194,6582,NA,NA,1920,1920,us ug,Don't Belong,Courtyard,again just there a lot of people there it really an identity issue but rather that its just a bit nerve racking for me to be there
1194,6582,NA,NA,1920,1920,us ug,Don't Belong,Hallway2,when my social anxiety is making me feel self conscious it becomes harder for me to walk normally and comfortably as silly as that may sound this hallway which i have used primary as a connection between the grand staircase and the left part is difficult for me to go down because of that because there are those tables where people are sitting it hard for me not to feel judged when i pass by
1234,6522,NA,NA,1920,1920,us ug,Don't Belong,Courtyard,i always feel like people are watching me there
1234,6522,NA,NA,1920,1920,us ug,Don't Belong,Fishbowl,i feel like there are always too many people there for me to feel comfortable
1263,2107,NA,NA,1819,1920,us ug,Don't Belong,Courtyard,i am usually here eating studying alone so i feel more judged
1294,3441,NA,NA,1819,1920,us ug,Don't Belong,Fishbowl,i do not have really any friends on campus so i feel like i stick out sitting and eating or studying by myself
1313,5652,NA,NA,1920,1920,us ug,Don't Belong,MCC,it feels kind of like a clique
476,1396,NA,NA,1718,1920,us ug,Don't Belong,AtriumEast,feels reserved for the more social students
476,1396,NA,NA,1718,1920,us ug,Don't Belong,Fishbowl,feels reserved for the more social students
1321,1362,NA,NA,1718,1920,us ug,Don't Belong,Courtyard,it is loud and packed with groups of people i for the most part do not identify with ie sorority fraternity members
1321,1362,NA,NA,1718,1920,us ug,Don't Belong,Craft,i do not fit the identity of many who frequent the center because i am not an art student
1321,1362,NA,NA,1718,1920,us ug,Don't Belong,FallingSky,it is often full of groups of friends and is not a place i would go to alone
1347,7305,NA,NA,1920,1920,us ug,Don't Belong,MCC,i do not have the same interest that those who go there do
1351,5353,NA,NA,1920,1920,us ug,Don't Belong,AtriumEast,all of the chairs are occupied and i do not know anyone
1370,3091,NA,NA,1819,1920,us ug,Don't Belong,Courtyard,i am more introverted and anxious when i am around big groups of loud people that are hanging around with their friends i feel like i do not belong
1370,3091,NA,NA,1819,1920,us ug,Don't Belong,Fishbowl,i am more introverted and anxious when i am around big groups of loud people that are hanging around with their friends i feel like i do not belong
1396,8262,NA,NA,1920,1920,us ug,Don't Belong,LGBTQA3,i am a part of the lgbt community but feel intimidated by the visibility of it and feel disconnected from people like me
36,196,NA,NA,1516,1920,us ug,Don't Belong,AtriumEast,this is mostly due to the fact that i do not like large groups but i find it hard to focus or spend time here due to how many people are around all the time
36,196,NA,NA,1516,1920,us ug,Don't Belong,Courtyard,this is just a super busy spot and sometimes it gets so crowded its hard to navigate through i am just not a big fan of places where large groups gather
1417,5542,NA,NA,1920,1920,us ug,Don't Belong,Craft,i am too scared to go in there since i am just now rekindling my love for art and starting it up again i do not feel good enough to be in there and i do not like looking like i am lost and that i do not know what i am doing
1417,5542,NA,NA,1920,1920,us ug,Don't Belong,MCC,i wanted to be a part of the multicultural center since i am multicultural but when i walked in i felt out of place since i look a lot lighter than the rest of them
1417,5542,NA,NA,1920,1920,us ug,Don't Belong,Mills,i was comfortable there since during introducktion i spent some time in there and i was told it was part of the multicultural center but when i visited with my roommate during the school year i got strange stares from people i did not recognize and the person i talked to did not seem to happy that i was there i was looking for the printer since i was told i was able to use the printer for free by the people in the multicultural community
1418,7904,NA,NA,1920,1920,us ug,Don't Belong,Craft,i do not feel creative enough and i do not have money for it
795,1586,NA,NA,1819,1920,us ug,Don't Belong,Mills,it is always crowded and so i feel like i can not spend as much time as i would like to there
450,1357,NA,NA,1718,1920,us ug,Don't Belong,Courtyard,super high traffic social areas on campus i am not a big fan of simply because when you are sitting alone you feel really disconnected or just anti social
450,1357,NA,NA,1718,1920,us ug,Don't Belong,Fishbowl,same as the reason above
1500,2975,NA,NA,1819,1920,us ug,Don't Belong,AtriumEast,such a wide group of people and it fees like it set up for people watching
1500,2975,NA,NA,1819,1920,us ug,Don't Belong,Courtyard,such a wide group of people and it fees like it set up for people watching
1514,3076,NA,NA,1819,1920,us ug,Don't Belong,Courtyard,i do not know why
1523,2234,NA,NA,1819,1920,us ug,Don't Belong,AtriumSouth,same as the fishbowl
1523,2234,NA,NA,1819,1920,us ug,Don't Belong,Fishbowl,cloud anxiety i feel like i am being judged just walking through its probably all in my head but i still feel that way
1537,5213,NA,NA,1920,1920,us ug,Don't Belong,Courtyard,people are hanging out with their friends and i am usually not with friends in that area
1537,5213,NA,NA,1920,1920,us ug,Don't Belong,Fishbowl,people are hanging out with their friends and i am usually not with friends in that area
1537,5213,NA,NA,1920,1920,us ug,Don't Belong,OLounge,people are hanging out with their friends and i am usually not with friends in that area
356,1195,NA,NA,1718,1920,us ug,Don't Belong,Fishbowl,i typically do not go to this space because a lot of students who i do not typically fit in with aka greek life members hang out here
833,4257,NA,NA,1819,1920,us ug,Don't Belong,Courtyard,i like to get food from there but when i hate eating in public when i am alone
1570,4576,NA,NA,1920,1920,us ug,Don't Belong,OLounge,i feel uncomfortable going in alone since almost everyone is in groups
1574,5545,NA,NA,1920,1920,us ug,Don't Belong,OLounge,it an awkwardly busy space
1595,8065,NA,NA,1920,1920,us ug,Don't Belong,AtriumEast,lots of people all the time
1599,4989,NA,NA,1920,1920,us ug,Don't Belong,AtriumEast,there are always so many people here it stresses me out
1599,4989,NA,NA,1920,1920,us ug,Don't Belong,Courtyard,there are always a lot of people here it makes me really anxious
892,2512,NA,NA,1819,1920,us ug,Don't Belong,Craft,i feel like the services at a full university should be better here my high school had better craft supplies and management than this and had systems in place which allowed students education and collaboration with the people who work in with said crafts in the creation of the projects which is inherent to growth
892,2512,NA,NA,1819,1920,us ug,Don't Belong,MCC,what does this place even do as a non caucasian student i just see this as the university insurance policy oh look at us we are diverse says the board of caucasians to the young woke and conscious white students while i might be slightly exaggerating the air of truth remains as a pacific islander this place is not accepting of my culture i feel like part of the problem is that the center and the school believes specifically for hawaiian culture that the hawaii club covers this space for native hawaiians it does not hawaii club represents the continued colonization of my ancestors homes and the appropriation of my culture this is seen explicitly in the luau where tiki not even hawaiian tourist tokenisms run rampant devoid of any actual culture meat that brings differents and creativity seen for example in the awesome hispanic activities of the multicultural center
1678,1550,NA,NA,1819,1920,us ug,Don't Belong,Courtyard,it feels like a school cafeteria and if given the option i would eat almost anywhere else on campus it discouraging to see so many people with their friend groups and eat alone
1678,1550,NA,NA,1819,1920,us ug,Don't Belong,Fishbowl,so crowded so loud so busy it is all of the things that trigger panic in me in one confined space sometimes when it quiet i can sneak in for starbucks but as far as using the space staying in the space absolutely not
1678,1550,NA,NA,1819,1920,us ug,Don't Belong,Hallway1,i mean i did not mean to click the hallway i guess the multicultural center i feel like as a 3rd gen immigrant i would like to seek support from this group but i honestly do not want to just look like a white oregonian trying to justify my heritage
1696,1408,NA,NA,1718,1920,us ug,Don't Belong,Fishbowl,honestly there is never ever enough seating i also feel like everyone is always in the emu studying or eating with friends so it hard to be alone there
1710,972,NA,NA,1617,1920,us ug,Don't Belong,Fishbowl,there is a lot of people
1746,2341,NA,NA,1819,1920,us ug,Don't Belong,Fishbowl,it just feels kind of awkward there sometimes and i run into people i dont want to see
1765,1669,NA,NA,1819,1920,us ug,Don't Belong,Fishbowl,so many young students i am older and it makes me uncomfortable
1765,1669,NA,NA,1819,1920,us ug,Don't Belong,OLounge,so many young students i am older and it makes me uncomfortable but i have spent time in the back area close to the pizza place
1797,7662,NA,NA,1920,1920,us ug,Don't Belong,Courtyard,because i have social anxiety and this is a very social place
1797,7662,NA,NA,1920,1920,us ug,Don't Belong,OLounge,because i have social anxiety and this is a very social place
1805,5572,NA,NA,1920,1920,us ug,Don't Belong,Fishbowl,if i am ever in the fishbowl without friends i feel lonely and out of place everyone there is usually eating lunch and hanging out with friends so if i go alone i feel like i do not belong
1824,7414,NA,NA,1920,1920,us ug,Don't Belong,Courtyard,just very overwhelming with soo many people gives me anxiety so i avoid
1824,7414,NA,NA,1920,1920,us ug,Don't Belong,Craft,always wanted to express creativity but do not have enough knowledge to know if everyone is welcomed there
955,2764,NA,NA,1819,1920,us ug,Don't Belong,Fishbowl,everything always feels so busy and theres so many people with friends and people connecting i feel very left out and overwhelemed
1853,2795,NA,NA,1819,1920,us ug,Don't Belong,Craft,never been interested in craft
1882,1659,NA,NA,1819,1920,us ug,Don't Belong,Courtyard,there are a lot of people with friends and i do not have friends on campus
1882,1659,NA,NA,1819,1920,us ug,Don't Belong,Fishbowl,there are a lot of people with friends and i do not have friends on campus
1901,NA,8,NA,Sophomore,1920,intl ug,Belong,AtriumEast,it bright vibrant and easily accessible to everyone
1901,NA,8,NA,Sophomore,1920,intl ug,Belong,Mills,international student
1902,NA,9,NA,Junior,1920,intl ug,Belong,MCC,i clicked the wrong button
1902,NA,9,NA,Junior,1920,intl ug,Belong,Mills,i have met lots of people there leading language circle having regular meetings etc
1903,NA,10,NA,Senior,1920,intl ug,Belong,Fishbowl,this is a hang out place with my friends
1903,NA,10,NA,Senior,1920,intl ug,Belong,Mills,sometimes i visit their events
1905,NA,12,NA,Senior,1920,intl ug,Belong,Fishbowl,having food often
1910,NA,17,NA,Senior,1920,intl ug,Belong,DuckStore,friendly staff
1910,NA,17,NA,Senior,1920,intl ug,Belong,FreshMarket,friendly staff
1914,NA,21,NA,Freshman,1920,intl ug,Belong,OLounge,i went to there a lot
1915,NA,22,NA,Sophomore,1920,intl ug,Belong,MCC,enough diversity and they present some intl movies sometimes
1915,NA,22,NA,Sophomore,1920,intl ug,Belong,Mills,because there enough diversity active community and i hear music from different countries as well as music from my country which makes me feel welcomed most
1919,NA,26,NA,Senior,1920,intl ug,Belong,Mills,like what the goal of the mills center is for mills just creates this homey feeling where every international student can be comfortable there events held there is also a great way to meet and connect with others both domestic and international
1919,NA,26,NA,Senior,1920,intl ug,Belong,TaylorLounge,before and after my classes when i have time in between i would just head there and do my homework i am able to meet quite a few people when they walk past there and sometimes we just chill and hang around there
1920,NA,27,NA,Junior,1920,intl ug,Belong,Mills,amazing place for studying and chilling with friends in my freshman year i usually went to the mills just to study however now that i met several international students it is rare that i visit the mills without having a conversation with a friend the person at the desk always welcomes me with a smile as well so it always a refreshing visiting this place
1922,NA,29,NA,Freshman,1920,intl ug,Belong,Mills,everyone are mostly international students there nice to make friends or just hang around
1922,NA,29,NA,Freshman,1920,intl ug,Belong,TaylorLounge,it is very nice to study there and when you play the piano there people sometimes appreciate it
1923,NA,30,NA,Junior,1920,intl ug,Belong,FallingSky,i love pizzas and a lot of cascade researchers go there for meetings and eating
1923,NA,30,NA,Junior,1920,intl ug,Belong,Mills,i am an international student but i have been only once there
1923,NA,30,NA,Junior,1920,intl ug,Belong,OLounge,i like playing pool with my friends
1924,NA,31,NA,Junior,1920,intl ug,Belong,Courtyard,courtyard dining is one of my popular meeting spots for class projects or group hangouts it is a huge area that welcomes everyone at the campus especially because it is surrounded by food spots my friends and i usually come down here to eat and since everybody is either eating or studying i feel welcomed in this place
1924,NA,31,NA,Junior,1920,intl ug,Belong,Mills,the mills international center is my go to place on an everyday basis i feel like i belong there because of their welcoming nature towards the international community it is also a very cozy place where i usually go to relax and study with my friend group they always greet everyone who enters the place and remain friendly and helpful towards everybody
1924,NA,31,NA,Junior,1920,intl ug,Belong,TaylorLounge,the taylor lounge is an area of peace and quiet i have often seen people come there to study i do feel accepted there because there is no disturbance it is also like a waiting lounge when i often find my friends
1926,NA,33,NA,Senior,1920,intl ug,Belong,Mills,it provides safe space for internaitonal studensts and students whos interested in international culture
1927,NA,34,NA,Senior,1920,intl ug,Belong,Courtyard,whenever the mills is crowded i would then go to the courtyard dining area i would usually go there to each lunch or to meet up with some friends for fun or for group work it a pleasant area to meet up even though it can get pretty noisy
1927,NA,34,NA,Senior,1920,intl ug,Belong,Fishbowl,similar to the courtyard dining i would go to the fishbowl to eat lunch meet up with my friends or do group work i usually try to get a spot on the couches area but they are rarely empty nevertheless it nice and bright since i usually go there during the day
