id,id_bl,id_si,id_eoy22,cohort,ayear,sample,sent,place,reason
129,572,NA,NA,1617,1920,us ug,Belong,Fishbowl,i enjoy the fishbowl as it is a lot of fellow students all in the same place and it is an enjoyable place to come have lunch and study it is one of my top 5 spots to go on campus
1193,4315,NA,NA,1819,1920,us ug,Belong,LGBTQA3,this is the only place where my identity and pronouns are always respected and i do not have to question whether i am safe trans support group helps me feel connected
126,567,NA,NA,1617,1920,us ug,Belong,Craft,space to pursue creative interests without pressure
126,567,NA,NA,1617,1920,us ug,Belong,MCC,i feel more valid in my identity here
1196,5253,NA,NA,1920,1920,us ug,Belong,AtriumSouth,connect the ducks
1196,5253,NA,NA,1920,1920,us ug,Belong,LGBTQA3,i got my gay lanyard
1196,5253,NA,NA,1920,1920,us ug,Belong,OLounge,i felt good and productive doing homework there
1200,8370,NA,NA,1920,1920,us ug,Belong,Fishbowl,i had a lot of study sessions there and it was nice to hang out there with my peers and learn
1207,5060,NA,NA,1920,1920,us ug,Belong,AtriumSouth,its a nice place to study between classes and its a fun spot to people watch or hang with my roommate
1207,5060,NA,NA,1920,1920,us ug,Belong,Fishbowl,the atmosphere is welcoming and always buzzing with so many different people
1208,5666,NA,NA,1920,1920,us ug,Belong,Fishbowl,it a very relaxing place to sit and do some homework
1208,5666,NA,NA,1920,1920,us ug,Belong,OLounge,it a very relaxing place to sit and do some homework
1209,5013,NA,NA,1920,1920,us ug,Belong,Courtyard,i would hang out with friends there and had lasting memories in the courtyard
1209,5013,NA,NA,1920,1920,us ug,Belong,OLounge,i would hang out with friends there and had lasting memories in the lounge
1211,7541,NA,NA,1920,1920,us ug,Belong,OLounge,its very comfortable and people are respectful
1211,7541,NA,NA,1920,1920,us ug,Belong,Womens,because they are so welcoming and helpful
456,1366,NA,NA,1718,1920,us ug,Belong,AtriumEast,i often study here and it is clear that anyone and everyone can just take a seat without getting permission from anyone
456,1366,NA,NA,1718,1920,us ug,Belong,FallingSky,this restaurant is very nice to its customers and i have only had positive experiences here
456,1366,NA,NA,1718,1920,us ug,Belong,Fishbowl,this is a place i eat at often and have gone to a few social events here anyone can be here
1217,6329,NA,NA,1920,1920,us ug,Belong,Fishbowl,because there is so much diversity there
1217,6329,NA,NA,1920,1920,us ug,Belong,MCC,no one judges me
1218,5604,NA,NA,1920,1920,us ug,Belong,Fishbowl,i can do my work and no one annoys me because everyone else is doing work it a good environment
1218,5604,NA,NA,1920,1920,us ug,Belong,OLounge,i can do my work and no one annoys me because everyone else is doing work it a good environment
1219,1980,NA,NA,1819,1920,us ug,Belong,FallingSky,it is a great atmosphere
1219,1980,NA,NA,1819,1920,us ug,Belong,Fishbowl,it is a fun place to be and it seems that everyone enjoys being there
1220,6970,NA,NA,1920,1920,us ug,Belong,Womens,they let me do free printing and they were super nice i feel like if i needed support i am any way i could go there
1221,2808,NA,NA,1819,1920,us ug,Belong,DuckNest,the duck nest was such a relaxing place if i ever felt overworked sad really stressed or worried i would go there i felt vulnerable and at ease which is not something i feel often during college
1221,2808,NA,NA,1819,1920,us ug,Belong,Fishbowl,i would go there a lot to study and loved the hustle and bustle feeling of it i liked being surrounded by uo students i also enjoyed watching campus tours walk through and sat there wishing i could tell them how much i loved the school
484,1413,NA,NA,1718,1920,us ug,Belong,DuckNest,the duck nest is very calming and accepting
484,1413,NA,NA,1718,1920,us ug,Belong,FallingSky,everyone there is super nice and they allow you to just sit and work with a slice of pizza or a cider or something
484,1413,NA,NA,1718,1920,us ug,Belong,Womens,i am a woman and the woman center is very inclusive
1222,2849,NA,NA,1819,1920,us ug,Belong,Womens,it a very welcoming safe space
1223,2967,NA,NA,1819,1920,us ug,Belong,Courtyard,i am often here with friends
1223,2967,NA,NA,1819,1920,us ug,Belong,Womens,i am a woman
898,1556,NA,NA,1819,1920,us ug,Belong,Fishbowl,the people i have seen here are very nice
898,1556,NA,NA,1819,1920,us ug,Belong,MCC,i feel more connected here as i am a student who identifies as another race other than white
898,1556,NA,NA,1819,1920,us ug,Belong,Womens,i feel connected because i am a cisgender female
1228,5830,NA,NA,1920,1920,us ug,Belong,DuckStore,me and my friends would walk around the duck store just look at art supplies and the workers were always nice it was a good place to go to when i needed anything
1228,5830,NA,NA,1920,1920,us ug,Belong,Fishbowl,i loved sitting outside and reading doing homework or engaging with booths and people that were out there
1230,2124,NA,NA,1819,1920,us ug,Belong,Craft,the staff are all amazing the access to materials is easy and there always fun events and interesting classes occurring easily the most important place in the emu to maintain and support and i feel very comfortable starting new projects asking for advice and creating beautiful things
1232,1321,NA,NA,1718,1920,us ug,Belong,MCC,i am mexican and i have noticed that when i surround myself with people who have a similar background to mine i am almost automatically able to feel at home
570,751,NA,NA,1617,1920,us ug,Belong,MCC,i am asian so no matter what i feel accepted there
570,751,NA,NA,1617,1920,us ug,Belong,Womens,people at the women center are very accepting and kind making anyone feel comfortable there
1236,1945,NA,NA,1819,1920,us ug,Belong,DuckStore,people are nice and have no judgement
1236,1945,NA,NA,1819,1920,us ug,Belong,Fishbowl,it very open and everyone is kind
1237,5583,NA,NA,1920,1920,us ug,Belong,MCC,i spent many hours here after joining clubs and knowing there are offices there that i could study or hang out with others in
1237,5583,NA,NA,1920,1920,us ug,Belong,Mills,many people i know work here and very much enjoy it the people are super nice and welcoming
1240,1653,NA,NA,1819,1920,us ug,Belong,Mills,i belong to an asian student group whose office is neighboring the mill center there is also a lot of overlap of members
1245,1961,NA,NA,1819,1920,us ug,Belong,MCC,as a person of color i feel accepted in the environment and connect with my peers it is a safe space to converse with people that may have the same experiences as me
1245,1961,NA,NA,1819,1920,us ug,Belong,Mills,the environment is very friendly and its a good study space as well as a good place to make friends
1245,1961,NA,NA,1819,1920,us ug,Belong,Womens,as a woman i feel supported by the community and atmosphere i am able to gain access to any resources i need as well
1247,7491,NA,NA,1920,1920,us ug,Belong,FreshMarket,i like the food and the workers there are always really nice
1247,7491,NA,NA,1920,1920,us ug,Belong,OLounge,i am not sure why i just really enjoy the atmosphere here it a nice place to sit and study
215,792,NA,NA,1617,1920,us ug,Belong,Courtyard,everyone studies at this area
215,792,NA,NA,1617,1920,us ug,Belong,Craft,the craft center is a very welcoming environment
761,2961,NA,NA,1819,1920,us ug,Belong,Fishbowl,it a nice open space where everyone talks or studies it just comforting i do not know why
761,2961,NA,NA,1819,1920,us ug,Belong,Womens,they are very open and transparent they are friendly and sincere
1255,5786,NA,NA,1920,1920,us ug,Belong,Fishbowl,anyone can sit and eat
1255,5786,NA,NA,1920,1920,us ug,Belong,OLounge,it a place where anyone can hang out
1256,5431,NA,NA,1920,1920,us ug,Belong,TaylorLounge,this was one of my favorite places to study
1260,5865,NA,NA,1920,1920,us ug,Belong,Courtyard,nice place to study and get fresh air
1260,5865,NA,NA,1920,1920,us ug,Belong,Fishbowl,i would eat and study here with my friends a lot the emu is in the center of campus so it was super convenient to stop by and get food or to meet up with friends
1260,5865,NA,NA,1920,1920,us ug,Belong,OLounge,this is where my friends and i would also typically study i also felt that i could come here and study alone and be able to focus well and maybe run into some people i know
557,473,NA,NA,1516,1920,us ug,Belong,FallingSky,it designed as a place to gather it feels right going there to socialize have a beer with friends or just do some work alone
1266,6584,NA,NA,1920,1920,us ug,Belong,Mills,i visited the mills international center for french game night and it was so fun and everyone was super welcoming
1266,6584,NA,NA,1920,1920,us ug,Belong,OLounge,i think they hold some cool events like watch parties right here that i like to attend with my friends
1268,7434,NA,NA,1920,1920,us ug,Belong,MCC,i am mulitcultual and they are very accepting
1270,8157,NA,NA,1920,1920,us ug,Belong,AtriumEast,i feel like this in the east atrium because there are many tables where i can many times go and sit down to either study work or even relax at the east atrium is pretty noise concentrated as well with not to much of it
1270,8157,NA,NA,1920,1920,us ug,Belong,Courtyard,i feel like this in the courtyard dining because it is a place that i am able to actually sit down and eat my food at and where there is no sense of rush
1270,8157,NA,NA,1920,1920,us ug,Belong,FallingSky,i feel this since the pizza there is great the employes are really friendly and the atmosphere feels just right
1272,6565,NA,NA,1920,1920,us ug,Belong,Hallway2,when i walk around here i feel like i never get any dirty looks frowns etc it feels like a relaxed environment
118,548,NA,NA,1617,1920,us ug,Belong,OLounge,i see a lot of my friends walking by there because we all like dr brew tea
1273,4963,NA,NA,1920,1920,us ug,Belong,Fishbowl,my friends and i eat here on occasion for fun
1274,4377,NA,NA,1819,1920,us ug,Belong,MCC,i see people that look like me on campus and are interested in the same social justice activities
1275,4309,NA,NA,1819,1920,us ug,Belong,DuckNest,i like the feel of the duck nest i got there in between classes and such
1275,4309,NA,NA,1819,1920,us ug,Belong,Fishbowl,i am there all the time with friends or alone nice environment
1277,3227,NA,NA,1819,1920,us ug,Belong,FallingSky,fundraisers cool vibe
1277,3227,NA,NA,1819,1920,us ug,Belong,Fishbowl,social place
1284,6398,NA,NA,1920,1920,us ug,Belong,Womens,i have only been here a few times to use the free printing and even though i was only there to use the service the employees at the wc always make me feel welcome and are super helpful with any questions
1289,5727,NA,NA,1920,1920,us ug,Belong,Fishbowl,i went to many fairs here and even volunteered once they were fun and i learned alot
1292,8127,NA,NA,1920,1920,us ug,Belong,DuckNest,the duck nest is a great place that i can go where i may go when i feel stressed i have gone to sleep there a couple times
1292,8127,NA,NA,1920,1920,us ug,Belong,MCC,the multicultural center is a hub where i see many latinos walk into and it feels good to study there
1292,8127,NA,NA,1920,1920,us ug,Belong,Mills,the mills international center is a calm and quiet place where students from all over the world can hangout quite frankly i feel very peaceful when i am among students who have a different perspective in life i welcome diversity
1295,7758,NA,NA,1920,1920,us ug,Belong,Mills,mills international center has such a calm atmosphere i love how peaceful it is i always love going their to study
1297,2239,NA,NA,1819,1920,us ug,Belong,FallingSky,the space in falling sky is very comforting and i love going to eat their with my friends or even to study and grab lunch on average i have noticed that more graduate students upper classman and staff spend time there and i like that
1297,2239,NA,NA,1819,1920,us ug,Belong,Fishbowl,the fishbowl is an open space that i can always go to sit being able to see outside feel the light come in and see all of the people come in and out is such an amazing place to be even if i am not with my friends i am able to sit solo and enjoy it i wish there were more places like this on campus
1297,2239,NA,NA,1819,1920,us ug,Belong,Mills,as an ethnic student i find a lot of comfort in the mills not only is the space so calming and welcoming to be in but the staff always make me feel welcomed and like i belong
1298,8369,NA,NA,1920,1920,us ug,Belong,DuckNest,they are my kind of people that chill out in there at least the staff are sometimes i felt like the people who would visit there were not too friendly but i liked the volunteers so i did not care
1299,7922,NA,NA,1920,1920,us ug,Belong,Womens,this is one of the only places in the emu i really went to get help and get connected and they were so friendly and helpful
1300,2572,NA,NA,1819,1920,us ug,Belong,Fishbowl,i dunno i just sit there with friends a lot between classes
1301,5498,NA,NA,1920,1920,us ug,Belong,Fishbowl,i spent a lot of time doing homework and meeting up with friends there
1301,5498,NA,NA,1920,1920,us ug,Belong,FreshMarket,the workers there have always been extremely friendly and it is a place where i would go often with friends to grab a quick snack before class or before doing homework
1302,5863,NA,NA,1920,1920,us ug,Belong,Fishbowl,this was a place where i went to do homework a lot and there is always a mix of what people are here
1304,6021,NA,NA,1920,1920,us ug,Belong,Fishbowl,its a place where anyone can sit with friends and its not dedicated to one type of group a lot of times my friends and i would go for starbucks or dinner and sit there
1306,2192,NA,NA,1819,1920,us ug,Belong,Craft,i really enjoy taking the art classes here the classes have been fun and inclusive it is one of the only things i have enjoyed taking part in on campus
1306,2192,NA,NA,1819,1920,us ug,Belong,Fishbowl,it is a nice place to meet with friends for coffee or studying in between classes
1307,6361,NA,NA,1920,1920,us ug,Belong,Craft,i have been into the craft center a few times and the staff are always helpful and welcoming
1307,6361,NA,NA,1920,1920,us ug,Belong,OLounge,this is one of the places i often study so it feels like a place that i belong in
297,1037,NA,NA,1617,1920,us ug,Belong,Courtyard,because there a diverse group of people all eating here all the time
297,1037,NA,NA,1617,1920,us ug,Belong,Fishbowl,there a diverse group of people commonly gathered here
1308,5202,NA,NA,1920,1920,us ug,Belong,DuckNest,i like all the treats and events to chill out
1308,5202,NA,NA,1920,1920,us ug,Belong,MCC,uo vsa is a cultural club that was nice to have participate in
1308,5202,NA,NA,1920,1920,us ug,Belong,OLounge,my friends studied there a lot
1309,3232,NA,NA,1819,1920,us ug,Belong,LGBTQA3,i identify as queer and it nice to have this center and gender neutral restrooms i feel like if i need to talk about something related to my queerness there a place i know i will be safe
1309,3232,NA,NA,1819,1920,us ug,Belong,MCC,the multicultural center is relevant to me because i am korean american it nice to have a space made for people who are not the majority there a kind of common understanding
1310,1487,NA,NA,1718,1920,us ug,Belong,Courtyard,it a good place to study with friends
1310,1487,NA,NA,1718,1920,us ug,Belong,Fishbowl,this is another place that i feel is a good study spot and is communal
380,1234,NA,NA,1718,1920,us ug,Belong,Craft,staff are friendly and its where i can be at peace and stress relief
380,1234,NA,NA,1718,1920,us ug,Belong,MCC,i feel welcome here with the staff atmosphere and layout of the mills center
1314,6200,NA,NA,1920,1920,us ug,Belong,AtriumSouth,there is not a specific reason that was just one of the areas that i hung out with my friends in just in general the ground level not like specifically the south atrium
1314,6200,NA,NA,1920,1920,us ug,Belong,Courtyard,my friends and i used to hang out there a lot
1316,7606,NA,NA,1920,1920,us ug,Belong,Courtyard,everyone could eat there whether they were parents students or faculty and no one cared great place to get work done while also grabbing a bite to eat before or after class
1316,7606,NA,NA,1920,1920,us ug,Belong,Craft,they reached out to me and i was about to start going there more often before the campus closed this year however everyone was super nice and it was a very calming environment to be in
1316,7606,NA,NA,1920,1920,us ug,Belong,Womens,this place gave me somewhere to print my papers and relax in between my classes which was really nice everyone was super chill and minded their own business which is something i really enjoyed
443,1342,NA,NA,1718,1920,us ug,Belong,Fishbowl,its a nice social area where you can also study
1318,4465,NA,NA,1819,1920,us ug,Belong,Craft,there is a variety of activities to take part in everyone is artistic in their own way
466,1378,NA,NA,1718,1920,us ug,Belong,MCC,it is a great place to learn new cultures and i feel comfortable to practice new languages there
466,1378,NA,NA,1718,1920,us ug,Belong,OLounge,i meet up with friends there often and have many good memories of late night studying together
567,626,NA,NA,1617,1920,us ug,Belong,Fishbowl,food
567,626,NA,NA,1617,1920,us ug,Belong,OLounge,food
1324,5784,NA,NA,1920,1920,us ug,Belong,Mills,i am currently a romance language major and the employees were always kind when i would often stop by for language circles
198,750,NA,NA,1617,1920,us ug,Belong,Fishbowl,whenever i have out of town guests we grab lunch in the fishbowl it just feels really central to uo and i like being able to see out to that walkway where people are always tabling you can see all the different clubs at school also it has chipotle
198,750,NA,NA,1617,1920,us ug,Belong,TaylorLounge,i loved sitting in taylor lounge when i was between classes if you sit in one of the soft chairs near the window you can see everybody come and go on the ground floor and there usually somebody playing piano
505,1462,NA,NA,1718,1920,us ug,Belong,Courtyard,i go there all the time to study with friends or by myself
505,1462,NA,NA,1718,1920,us ug,Belong,MCC,as a person of color i appreciate this place as one to go to to see people who are similar to me and to look at different student perspectives
1325,2402,NA,NA,1819,1920,us ug,Belong,Fishbowl,many of my friends and i eat and hangout here
1327,5308,NA,NA,1920,1920,us ug,Belong,MCC,a lot of the people from similar upbringing go here
1329,4729,NA,NA,1920,1920,us ug,Belong,AtriumEast,everyone lounging or studying there is in the same boat i feel like they are my people
1329,4729,NA,NA,1920,1920,us ug,Belong,FallingSky,everyone there just comes for some good pizza man the workers are friendly and chill
1329,4729,NA,NA,1920,1920,us ug,Belong,TaylorLounge,gosh i love this lounge i love piano music so it cool when somebody plays the grand piano it so cozy
1330,6109,NA,NA,1920,1920,us ug,Belong,Fishbowl,great place to study meet up with people
1332,6713,NA,NA,1920,1920,us ug,Belong,Courtyard,it a nice atmosphere to eat
1332,6713,NA,NA,1920,1920,us ug,Belong,TaylorLounge,it a nice place to work while others are working around you
1333,5227,NA,NA,1920,1920,us ug,Belong,FallingSky,good pizza
1339,6949,NA,NA,1920,1920,us ug,Belong,Craft,i feel like it has a good environment and as i have a background in art from high school i have many similar interests to the people there they are very helpful and understanding
1340,6912,NA,NA,1920,1920,us ug,Belong,Starbucks,the staff is always super friendly and i go there with friends
1340,6912,NA,NA,1920,1920,us ug,Belong,TaylorLounge,i love to study there or spend time in between classes
1340,6912,NA,NA,1920,1920,us ug,Belong,Womens,whenever i went there everyone was very kind and helpful
1341,6760,NA,NA,1920,1920,us ug,Belong,DuckStore,people do not expect me to be a certain way here
1341,6760,NA,NA,1920,1920,us ug,Belong,Fishbowl,people do not expect me to be a certain way here
524,1498,NA,NA,1718,1920,us ug,Belong,FallingSky,i enjoy meeting up with my friends there after classes and grabbing a bite to eat it a nice environment
524,1498,NA,NA,1718,1920,us ug,Belong,Fishbowl,i get food here regularly after classes so i feel pretty comfortable in here it just part of my routine
1343,6387,NA,NA,1920,1920,us ug,Belong,DuckNest,when walking into the duck nest you are welcomed by very nice students willing to help you with anything i love the feel and environment there
1343,6387,NA,NA,1920,1920,us ug,Belong,Fishbowl,there are so many different people that sit there you are able to meet a ton of different people everyone is always nice and welcoming
1343,6387,NA,NA,1920,1920,us ug,Belong,FreshMarket,it one of my favorite places to eat with friends after class and brings back happy memories all of the workers are very nice and including
1345,2071,NA,NA,1819,1920,us ug,Belong,Fishbowl,lots of people and it easy for me to get my work done
1348,6529,NA,NA,1920,1920,us ug,Belong,MCC,because there are a lot of people of color there and i feel like i belong there and will not be judged as a poc
1348,6529,NA,NA,1920,1920,us ug,Belong,Mills,the people there are very open minded and do not have mentalities that make me feel judged
1352,7614,NA,NA,1920,1920,us ug,Belong,Fishbowl,no
1352,7614,NA,NA,1920,1920,us ug,Belong,FreshMarket,no specific reason place to hang out with other students
1353,6075,NA,NA,1920,1920,us ug,Belong,Womens,the women center is a place that connects and supports women which is in line with my gender identity i feel that i could go here any time i need help
1354,2533,NA,NA,1819,1920,us ug,Belong,FallingSky,fewer people sit down by falling sky and it is a nicer corner where if you do not want to talk to anyone you do not have to
1354,2533,NA,NA,1819,1920,us ug,Belong,Fishbowl,everyone is able to sit where they want and you can sit next to someone you may not know without getting strange looks
1356,6738,NA,NA,1920,1920,us ug,Belong,DuckNest,it kind of is the chillest place on campus except when they have events then it way too crowded
1356,6738,NA,NA,1920,1920,us ug,Belong,Womens,i work at the wc i feel connected with my peers there
1357,905,NA,NA,1617,1920,us ug,Belong,FallingSky,all the workers are easy going and very friendly the ambiance of the brewery is also a perfect place to destress
1357,905,NA,NA,1617,1920,us ug,Belong,MCC,i am a first generation student of color the center helped me navigate my freshman year at uo
414,1286,NA,NA,1718,1920,us ug,Belong,OLounge,i like the tall tables so i can stand while i do schoolwork
414,1286,NA,NA,1718,1920,us ug,Belong,Womens,words can not explain the safe place the women center has provided for me
1358,7883,NA,NA,1920,1920,us ug,Belong,Courtyard,i was doing what everyone else was doing
869,2353,NA,NA,1819,1920,us ug,Belong,Fishbowl,i feel like the fishbowl is a great location that people use for passing by time or passing by between classes i have never felt uncomfortable and it nice always seeing my friends it also a great social hangout spot as well
869,2353,NA,NA,1819,1920,us ug,Belong,Womens,the women center is a place that allows me to be in the presence of other amazing women
1360,5179,NA,NA,1920,1920,us ug,Belong,Fishbowl,a lot of people do their homework here or meet with friends while getting lunch and i feel connected with people because we are all trying to get through the same thing just in a different way
1365,4923,NA,NA,1920,1920,us ug,Belong,FallingSky,i like the pool table outside of it they have events there sometimes and it feels like you are not on campus
177,695,NA,NA,1617,1920,us ug,Belong,AtriumEast,its a nice place to sit
199,755,NA,NA,1617,1920,us ug,Belong,LGBTQA3,its been my place for the last 4 years i have worked there hung out there and mentored lots of the underclassmen
1367,5633,NA,NA,1920,1920,us ug,Belong,DuckNest,they are very kind
1367,5633,NA,NA,1920,1920,us ug,Belong,FreshMarket,i have been in a few times it feels like a nice place
1367,5633,NA,NA,1920,1920,us ug,Belong,Starbucks,they are always super nice i go there frequently
1368,5239,NA,NA,1920,1920,us ug,Belong,Hallway1,i like the study spaces they allow you to look down over everything just makes you feel a part of something bigger a bigger story environment community
1368,5239,NA,NA,1920,1920,us ug,Belong,Hallway2,another nice study area again allows you to look over everything whilst not being too loud
1368,5239,NA,NA,1920,1920,us ug,Belong,TaylorLounge,very calming space people are working away chatting or playing piano
1371,3032,NA,NA,1819,1920,us ug,Belong,Courtyard,this is a place where i come to do a lot of my school work no one is really judging you for being there because most everyone there is also doing school work
1371,3032,NA,NA,1819,1920,us ug,Belong,Fishbowl,i also do a lot of my school work in the fishbowl it my favorite place on campus because i always see lots of people i know plus starbucks is right there
1375,7727,NA,NA,1920,1920,us ug,Belong,DuckNest,they let me take naps there and they bring dogs in sometimes plus all of the people that work there are really nice
1375,7727,NA,NA,1920,1920,us ug,Belong,Fishbowl,there is this lady who works at to starbucks and she learned my name and talked to me anytime that i went in there she made me feel welcome and accepted
1375,7727,NA,NA,1920,1920,us ug,Belong,LGBTQA3,i am a gay transgender man i am who they cater to that is why i feel that i fit in here
1378,7679,NA,NA,1920,1920,us ug,Belong,AtriumEast,another great place to relax in between classes and see a lot of familiar faces
1378,7679,NA,NA,1920,1920,us ug,Belong,OLounge,it was a great place to relax in between classes and see a lot of familiar faces
690,2807,NA,NA,1819,1920,us ug,Belong,MCC,everyone is friendly the place is a great place to relax and study
690,2807,NA,NA,1819,1920,us ug,Belong,Mills,staff are nice it is a good place to relax and talk with people
